agency,local_identifier,activity,status,decision,valid_from,valid_to,date_format,link[1],link_display_name[1],file[1].original_location,file[1].display_name,file[1].report_language[1],institution[1].deqar_id,institution[1].eter_id,institution[1].identifier[1],institution[1].name_official,institution[1].country[1],institution[1].city[1],institution[1].qf_ehea_level[1],institution[1].qf_ehea_level[2],institution[1].qf_ehea_level[3],institution[1].website_link,institution[2].eter_id,institution[3].eter_id,institution[4].name_official,institution[4].name_english,institution[4].country[1],institution[4].city[1],institution[4].qf_ehea_level[1],institution[4].qf_ehea_level[2],institution[4].qf_ehea_level[3],institution[4].website_link,programme[1].identifier[1],programme[1].name_primary,programme[1].qualification_primary,programme[1].nqf_level,programme[1].qf_ehea_level,programme[2].name_primary,programme[2].qualification_primary,programme[2].qf_ehea_level
MusiQuE,CRDB-October14,Quality enhancement reviews of institutions,part of obligatory EQA system,positive,2016-10-28,2018-01-15,%Y-%m-%d,,,http://www.musique-qe.eu/userfiles/File/2014-10-bruxelles-website.pdf,Evaluation report,fre,,BE0035,,,,,,,,,,,,,,,,,,,,,,,,,,
MusiQuE,HAMU-June15,Quality enhancement reviews of institutions,part of obligatory EQA system,positive,2016-06-15,2018-01-15,%Y-%m-%d,,,http://www.musique-qe.eu/userfiles/File/2015-06-25-hamu-review-reportfinal.pdf,Review report,eng,DEQARINST0245,,,,,,,,,,,,,,,,,,,,,,,,,,,
MusiQuE,PCC-June08,Quality enhancement reviews of programmes,part of obligatory EQA system,positive,2016-06-26,2018-01-15,%Y-%m-%d,,,http://www.musique-qe.eu/userfiles/File/2008-06-report-groningen-website.pdf,Review report,eng,,,,Prince Claus Conservatoire,NL,Groningen,short cycle,first cycle,second cycle,https://www.hanze.nl/eng/education/art/prince-claus-conservatoire,,,,,,,,,,,12,Master of Music program,Master,level 7,second cycle,,,
MusiQuE,SHM-April09,Quality enhancement reviews of programmes,part of obligatory EQA system,positive,2017-04-09,2022-02-15,%Y-%m-%d,,,http://www.musique-qe.eu/userfiles/File/2009-06-report-trossingen-website.pdf,Review report,ger,,DE0140,,,,,,,,,,,,,,,,,,,15,Master of Arts Organ Expert ,Master,level 7,second cycle,,,
MusiQuE,EAMT-September13,Quality enhancement reviews of joint programmes,part of obligatory EQA system,positive,2013-01-15,2015-01-15,%Y-%m-%d,,,http://www.musique-qe.eu/userfiles/File/final-reportaec-programme-reviewcopeco.pdf,Review report,eng,,EE0022,,,,,,,,,SE0037,FR0164,Hochschule für Musik und Theater Hamburg,Hamburg University of Music and Theatre,DE,Hamburg,short cycle,first cycle,second cycle,http://www.musikhochschule-hamburg.de,18,CoPeCo – Masters in Contemporary Performance and Composition,Master (no joint degree),level 6,second cycle,,,
ARACIS,UAUIMB-September28,institutional review,1,1,2017-09-28,2022-09-28,%Y-%m-%d,http://www.aracis.ro/rezultate-evaluari/evaluari-institutionale/rezultate/universitatea-de-arhitectura-si-urbanism-ion-mincu-din-bucuresti/,View report on ARACIS page,http://www.aracis.ro/uploads/media/Raport_Departament_de_evaluare_13882b.pdf,Report,rom,,,S003,,,,,,,,,,,,,,,,,,,Architecture,BA,,second cycle,Furniture and Interior Design,BA,second cycle
